{
  "sample_id": "SAMPLE_E2E_NORMAL",
  "quarter": "2024Q2",
  "ranking_cutoff": "2024-04-01",
  "profile_version": "v2-stage8-e2e",
  "industry_group": "G1",
  "jurisdiction_context": "federal",
  "quarter_number": 2,
  "history_inspections": 5,
  "history_positive_inspections": 2,
  "smoothed_positive_rate": 0.4286,
  "days_since_last_inspection": 90,
  "days_since_last_positive": 150,
  "inspections_365d": 2,
  "positives_365d": 1,
  "inspections_730d": 4,
  "positives_730d": 2,
  "decayed_inspections": 1.8,
  "decayed_positives": 0.9,
  "historical_standard_codes": ["1910.269", "1910.147"],
  "historical_risk_categories": ["R1", "R3"],
  "risk_category_counts": { "R1": 1, "R3": 1 },
  "risk_category_unmapped_rate": 0.0,
  "risk_score": 0.64,
  "risk_percentile": 0.12,
  "model_version": "M2-v1",
  "score_evidence": "frozen_m2_model.joblib SHA256=0000000000000000000000000000000000000000000000000000000000000000",
  "no_history_flag": false,
  "no_positive_history_flag": false,
  "missing_last_inspection_flag": false,
  "missing_last_positive_flag": false,
  "entity_match_uncertain_flag": false,
  "insufficient_evidence_flag": false
}
